{
  "sample_id": "SW-UBIQUITI_UNIFI_-S-008",
  "vendor": "Ubiquiti Networks",
  "product": "UniFi Switch USW-Pro",
  "device_type": "switch",
  "os": "UniFi OS",
  "version": "6.x",
  "category": "switch",
  "source_type": "synthetic",
  "source_url": null,
  "license": null,
  "configuration_format": "ini",
  "security_state": "secure",
  "controls_present": [
    "ssh_v2",
    "https_management",
    "syslog",
    "ntp",
    "strong_auth",
    "password_encryption",
    "session_timeout",
    "default_deny_policy"
  ],
  "controls_absent": [],
  "vulnerability_tags": [],
  "contains_secrets": false,
  "anonymized": true,
  "generation_date": "2026-09-22",
  "generator_version": "1.0.0",
  "security_state_details": "Fully hardened configuration following vendor best practices and CIS benchmark recommendations",
  "legacy_device_type": "switch",
  "device_class": "network_switch",
  "network_role": "perimeter",
  "platform": "Ubiquiti UniFi",
  "model": null,
  "capabilities": [
    "STP"
  ],
  "routing_protocols": [],
  "l2_capable": true,
  "detected_vendor": "ubiquiti_unifi",
  "detected_vendor_display": "Ubiquiti UniFi",
  "device_class_basis": "filename convention (SW-UBIQUITI_UNIFI_-S-008.conf)",
  "relabel_version": "2.0.0",
  "relabel_date": "2026-09-22",
  "label_confidence": "verified",
  "routing_capability": false
}