{
  "sample_id": "RT-CISCO_NXOS-S-012",
  "vendor": "Cisco",
  "product": "Nexus 9000 Router",
  "device_type": "router",
  "os": "Cisco NX-OS",
  "version": "10.x",
  "category": "router",
  "source_type": "synthetic",
  "source_url": null,
  "license": null,
  "configuration_format": "cisco_nxos_cli",
  "security_state": "secure",
  "controls_present": [
    "ssh_v2",
    "https_management",
    "syslog",
    "ntp",
    "strong_auth",
    "password_encryption",
    "session_timeout",
    "default_deny_policy"
  ],
  "controls_absent": [],
  "vulnerability_tags": [],
  "contains_secrets": false,
  "anonymized": true,
  "generation_date": "2026-09-22",
  "generator_version": "1.0.0",
  "security_state_details": "Fully hardened configuration following vendor best practices and CIS benchmark recommendations",
  "legacy_device_type": "router",
  "device_class": "network_switch",
  "network_role": "core",
  "platform": "Cisco IOS / IOS-XE",
  "model": null,
  "capabilities": [
    "BGP",
    "L2_SWITCHING",
    "OSPF",
    "STATIC_ROUTING",
    "VRF"
  ],
  "routing_protocols": [
    "BGP",
    "OSPF"
  ],
  "l2_capable": true,
  "detected_vendor": "cisco_ios",
  "detected_vendor_display": "Cisco IOS / IOS-XE",
  "device_class_basis": "defining construct: layer-2 forwarding constructs present alongside routing protocols (L3 switch)",
  "relabel_version": "2.0.0",
  "relabel_date": "2026-09-22",
  "label_confidence": "review",
  "label_disagreement": "Directory-derived label was 'router' but the configuration identifies as 'network_switch' via defining construct: layer-2 forwarding constructs present alongside routing protocols (L3 switch). Network role 'core' likely explains the original label (a routing role does not change the hardware class).",
  "routing_capability": true
}