{
  "sample_id": "IOT-INDUSTRIAL_WAGO-E-004",
  "vendor": "WAGO",
  "product": "PFC200 Controller",
  "device_type": "iot_plc",
  "os": "e!COCKPIT Linux",
  "version": "FW23",
  "category": "iot",
  "source_type": "synthetic",
  "source_url": null,
  "license": null,
  "configuration_format": "json",
  "security_state": "edge_case",
  "controls_present": [
    "partial"
  ],
  "controls_absent": [],
  "vulnerability_tags": [
    "ambiguous_syntax",
    "partial_config"
  ],
  "contains_secrets": false,
  "anonymized": true,
  "generation_date": "2026-09-22",
  "generator_version": "1.0.0",
  "security_state_details": "Partial configuration with deprecated syntax, missing sections, or conflicting rules",
  "legacy_device_type": "iot_plc",
  "device_class": "iot_controller",
  "network_role": "ot_cell",
  "platform": "WAGO e!COCKPIT",
  "model": null,
  "capabilities": [],
  "routing_protocols": [],
  "l2_capable": false,
  "detected_vendor": "wago",
  "detected_vendor_display": "WAGO PFC",
  "device_class_basis": "vendor product-line prior (wago)",
  "relabel_version": "2.0.0",
  "relabel_date": "2026-09-22",
  "label_confidence": "verified",
  "routing_capability": false
}