{
  "sample_id": "RT-JUNIPER_JUNOS-E-006",
  "vendor": "Juniper Networks",
  "product": "MX Series",
  "device_type": "router",
  "os": "Junos OS",
  "version": "22.x",
  "category": "router",
  "source_type": "synthetic",
  "source_url": null,
  "license": null,
  "configuration_format": "junos_hierarchy",
  "security_state": "edge_case",
  "controls_present": [
    "partial"
  ],
  "controls_absent": [],
  "vulnerability_tags": [
    "ambiguous_syntax",
    "partial_config"
  ],
  "contains_secrets": false,
  "anonymized": true,
  "generation_date": "2026-09-22",
  "generator_version": "1.0.0",
  "security_state_details": "Partial configuration with deprecated syntax, missing sections, or conflicting rules",
  "legacy_device_type": "router",
  "device_class": "router",
  "network_role": "edge",
  "platform": "Juniper Junos",
  "model": "Juniper MX",
  "capabilities": [
    "VRF"
  ],
  "routing_protocols": [],
  "l2_capable": false,
  "detected_vendor": "juniper_junos",
  "detected_vendor_display": "Juniper Junos",
  "device_class_basis": "model registry (Juniper MX)",
  "relabel_version": "2.0.0",
  "relabel_date": "2026-09-22",
  "label_confidence": "verified",
  "routing_capability": true
}