{
  "sample_id": "SW-SONIC_CONFIGDB_-E-010",
  "vendor": "Open Source / Linux Foundation",
  "product": "SONiC Leaf/Spine Switch",
  "device_type": "switch",
  "os": "SONiC",
  "version": "202311",
  "category": "switch",
  "source_type": "synthetic",
  "source_url": null,
  "license": null,
  "configuration_format": "sonic_config_db_json",
  "security_state": "edge_case",
  "controls_present": [
    "partial"
  ],
  "controls_absent": [],
  "vulnerability_tags": [
    "ambiguous_syntax",
    "partial_config"
  ],
  "contains_secrets": false,
  "anonymized": true,
  "generation_date": "2026-09-22",
  "generator_version": "1.0.0",
  "security_state_details": "Partial configuration with deprecated syntax, missing sections, or conflicting rules",
  "legacy_device_type": "switch",
  "device_class": "network_switch",
  "network_role": "unknown",
  "platform": "SONiC",
  "model": null,
  "capabilities": [],
  "routing_protocols": [],
  "l2_capable": false,
  "detected_vendor": "sonic",
  "detected_vendor_display": "SONiC",
  "device_class_basis": "filename convention (SW-SONIC_CONFIGDB_-E-010.json)",
  "relabel_version": "2.0.0",
  "relabel_date": "2026-09-22",
  "label_confidence": "verified",
  "routing_capability": false
}