{
  "sample_id": "SW-ALLIED_TELESIS_-E-003",
  "vendor": "Allied Telesis",
  "product": "x530 / x930 Series Switch",
  "device_type": "switch",
  "os": "AlliedWare Plus",
  "version": "5.5.x",
  "category": "switch",
  "source_type": "synthetic",
  "source_url": null,
  "license": null,
  "configuration_format": "allied_telesis_cli",
  "security_state": "edge_case",
  "controls_present": [
    "partial"
  ],
  "controls_absent": [],
  "vulnerability_tags": [
    "ambiguous_syntax",
    "partial_config"
  ],
  "contains_secrets": false,
  "anonymized": true,
  "generation_date": "2026-09-22",
  "generator_version": "1.0.0",
  "security_state_details": "Partial configuration with deprecated syntax, missing sections, or conflicting rules",
  "legacy_device_type": "switch",
  "device_class": "network_switch",
  "network_role": "edge",
  "platform": "AlliedWare Plus",
  "model": null,
  "capabilities": [
    "LINK_AGGREGATION"
  ],
  "routing_protocols": [],
  "l2_capable": false,
  "detected_vendor": "allied_telesis",
  "detected_vendor_display": "Allied Telesis AlliedWare Plus",
  "device_class_basis": "filename convention (SW-ALLIED_TELESIS_-E-003.conf)",
  "relabel_version": "2.0.0",
  "relabel_date": "2026-09-22",
  "label_confidence": "verified",
  "routing_capability": false
}