{
  "sample_id": "RT-JUNIPER_JUNOS-M-012",
  "vendor": "Juniper Networks",
  "product": "MX Series",
  "device_type": "router",
  "os": "Junos OS",
  "version": "22.x",
  "category": "router",
  "source_type": "synthetic",
  "source_url": null,
  "license": null,
  "configuration_format": "junos_hierarchy",
  "security_state": "misconfigured",
  "controls_present": [],
  "controls_absent": [
    "ssh_hardening",
    "logging",
    "password_encryption",
    "account_lockout",
    "telnet_disabled"
  ],
  "vulnerability_tags": [
    "telnet_enabled",
    "http_management",
    "snmpv2_default_community",
    "weak_password",
    "no_logging"
  ],
  "contains_secrets": false,
  "anonymized": true,
  "generation_date": "2026-09-22",
  "generator_version": "1.0.0",
  "security_state_details": "Deliberately insecure configuration with common misconfigurations for compliance testing",
  "legacy_device_type": "router",
  "device_class": "router",
  "network_role": "edge",
  "platform": "Juniper Junos",
  "model": "Juniper MX",
  "capabilities": [],
  "routing_protocols": [],
  "l2_capable": false,
  "detected_vendor": "juniper_junos",
  "detected_vendor_display": "Juniper Junos",
  "device_class_basis": "model registry (Juniper MX)",
  "relabel_version": "2.0.0",
  "relabel_date": "2026-09-22",
  "label_confidence": "verified",
  "routing_capability": false
}