{
  "sample_id": "RT-CISCO_IOS-E-006",
  "vendor": "Cisco",
  "product": "IOS Router",
  "device_type": "router",
  "os": "Cisco IOS",
  "version": "15.x",
  "category": "router",
  "source_type": "synthetic",
  "source_url": null,
  "license": null,
  "configuration_format": "cisco_ios_cli",
  "security_state": "edge_case",
  "controls_present": [
    "partial"
  ],
  "controls_absent": [],
  "vulnerability_tags": [
    "ambiguous_syntax",
    "partial_config"
  ],
  "contains_secrets": false,
  "anonymized": true,
  "generation_date": "2026-09-22",
  "generator_version": "1.0.0",
  "security_state_details": "Partial configuration with deprecated syntax, missing sections, or conflicting rules",
  "legacy_device_type": "router",
  "device_class": "router",
  "network_role": "unknown",
  "platform": "Cisco IOS / IOS-XE",
  "model": null,
  "capabilities": [
    "RIP"
  ],
  "routing_protocols": [
    "RIP"
  ],
  "l2_capable": false,
  "detected_vendor": "cisco_ios",
  "detected_vendor_display": "Cisco IOS / IOS-XE",
  "device_class_basis": "defining construct: routed interfaces with no layer-2 bridging",
  "relabel_version": "2.0.0",
  "relabel_date": "2026-09-22",
  "label_confidence": "verified",
  "routing_capability": true
}