{
  "sample_id": "FW-PALOALTO_PANOS-M-003",
  "vendor": "Palo Alto Networks",
  "product": "PAN-OS",
  "device_type": "firewall",
  "os": "PAN-OS",
  "version": "11.x",
  "category": "firewall",
  "source_type": "synthetic",
  "source_url": null,
  "license": null,
  "configuration_format": "panos_set_cli",
  "security_state": "misconfigured",
  "controls_present": [],
  "controls_absent": [
    "ssh_hardening",
    "logging",
    "password_encryption",
    "account_lockout",
    "telnet_disabled"
  ],
  "vulnerability_tags": [
    "telnet_enabled",
    "http_management",
    "snmpv2_default_community",
    "weak_password",
    "no_logging"
  ],
  "contains_secrets": false,
  "anonymized": true,
  "generation_date": "2026-09-22",
  "generator_version": "1.0.0",
  "security_state_details": "Deliberately insecure configuration with common misconfigurations for compliance testing",
  "legacy_device_type": "firewall",
  "device_class": "firewall",
  "network_role": "segmentation",
  "platform": "PAN-OS",
  "model": null,
  "capabilities": [
    "STATEFUL_POLICY"
  ],
  "routing_protocols": [],
  "l2_capable": false,
  "detected_vendor": "palo_alto_panos",
  "detected_vendor_display": "Palo Alto PAN-OS",
  "device_class_basis": "defining construct: stateful security policy / zone model",
  "relabel_version": "2.0.0",
  "relabel_date": "2026-09-22",
  "label_confidence": "verified",
  "routing_capability": false
}