{
  "sample_id": "WF-TPLINK_OMADA_WI-M-019",
  "vendor": "TP-Link",
  "product": "Omada EAP660 HD / EAP670",
  "device_type": "wifi_access_point",
  "os": "Omada OS",
  "version": "v5",
  "category": "wifi",
  "source_type": "synthetic",
  "source_url": null,
  "license": null,
  "configuration_format": "json",
  "security_state": "misconfigured",
  "controls_present": [],
  "controls_absent": [
    "ssh_hardening",
    "logging",
    "password_encryption",
    "account_lockout",
    "telnet_disabled"
  ],
  "vulnerability_tags": [
    "telnet_enabled",
    "http_management",
    "snmpv2_default_community",
    "weak_password",
    "no_logging"
  ],
  "contains_secrets": false,
  "anonymized": true,
  "generation_date": "2026-09-22",
  "generator_version": "1.0.0",
  "security_state_details": "Deliberately insecure configuration with common misconfigurations for compliance testing",
  "legacy_device_type": "wifi_access_point",
  "device_class": "wireless_ap",
  "network_role": "wireless_access",
  "platform": "TP-Link Omada",
  "model": null,
  "capabilities": [
    "WIRELESS_SSID"
  ],
  "routing_protocols": [],
  "l2_capable": false,
  "detected_vendor": "tplink_omada",
  "detected_vendor_display": "TP-Link Omada",
  "device_class_basis": "filename convention (WF-TPLINK_OMADA_WI-M-019.json)",
  "relabel_version": "2.0.0",
  "relabel_date": "2026-09-22",
  "label_confidence": "verified",
  "routing_capability": false
}