{
  "sample_id": "RT-EXTREME_EXOS-M-019",
  "vendor": "Extreme Networks",
  "product": "Summit / SLX Router",
  "device_type": "router",
  "os": "EXOS",
  "version": "32.x",
  "category": "router",
  "source_type": "synthetic",
  "source_url": null,
  "license": null,
  "configuration_format": "extreme_exos_cli",
  "security_state": "misconfigured",
  "controls_present": [],
  "controls_absent": [
    "ssh_hardening",
    "logging",
    "password_encryption",
    "account_lockout",
    "telnet_disabled"
  ],
  "vulnerability_tags": [
    "telnet_enabled",
    "http_management",
    "snmpv2_default_community",
    "weak_password",
    "no_logging"
  ],
  "contains_secrets": false,
  "anonymized": true,
  "generation_date": "2026-09-22",
  "generator_version": "1.0.0",
  "security_state_details": "Deliberately insecure configuration with common misconfigurations for compliance testing",
  "legacy_device_type": "router",
  "device_class": "network_switch",
  "network_role": "access",
  "platform": "ExtremeXOS",
  "model": "Extreme Summit",
  "capabilities": [
    "VLAN"
  ],
  "routing_protocols": [],
  "l2_capable": true,
  "detected_vendor": "extreme_exos",
  "detected_vendor_display": "Extreme EXOS",
  "device_class_basis": "model registry (Extreme Summit)",
  "relabel_version": "2.0.0",
  "relabel_date": "2026-09-22",
  "label_confidence": "review",
  "label_disagreement": "Directory-derived label was 'router' but the configuration identifies as 'network_switch' via model registry (Extreme Summit). Network role 'access' likely explains the original label (a routing role does not change the hardware class).",
  "routing_capability": false
}