{
  "sample_id": "FW-HILLSTONE_STONE-M-010",
  "vendor": "Hillstone",
  "product": "StoneOS",
  "device_type": "firewall",
  "os": "StoneOS",
  "version": "5.x",
  "category": "firewall",
  "source_type": "synthetic",
  "source_url": null,
  "license": null,
  "configuration_format": "hillstone_cli",
  "security_state": "misconfigured",
  "controls_present": [],
  "controls_absent": [
    "ssh_hardening",
    "logging",
    "password_encryption",
    "account_lockout",
    "telnet_disabled"
  ],
  "vulnerability_tags": [
    "telnet_enabled",
    "http_management",
    "snmpv2_default_community",
    "weak_password",
    "no_logging"
  ],
  "contains_secrets": false,
  "anonymized": true,
  "generation_date": "2026-09-22",
  "generator_version": "1.0.0",
  "security_state_details": "Deliberately insecure configuration with common misconfigurations for compliance testing",
  "legacy_device_type": "firewall",
  "device_class": "firewall",
  "network_role": "perimeter",
  "platform": "Hillstone StoneOS",
  "model": "Hillstone",
  "capabilities": [
    "STATEFUL_POLICY"
  ],
  "routing_protocols": [],
  "l2_capable": false,
  "detected_vendor": "hillstone",
  "detected_vendor_display": "Hillstone StoneOS",
  "device_class_basis": "model registry (Hillstone)",
  "relabel_version": "2.0.0",
  "relabel_date": "2026-09-22",
  "label_confidence": "verified",
  "routing_capability": false
}