{
  "sample_id": "RT-ALLIED_TELESIS_-M-015",
  "vendor": "Allied Telesis",
  "product": "AR4050S / AR3050S",
  "device_type": "router",
  "os": "AlliedWare Plus",
  "version": "5.5.x",
  "category": "router",
  "source_type": "synthetic",
  "source_url": null,
  "license": null,
  "configuration_format": "allied_telesis_cli",
  "security_state": "misconfigured",
  "controls_present": [],
  "controls_absent": [
    "ssh_hardening",
    "logging",
    "password_encryption",
    "account_lockout",
    "telnet_disabled"
  ],
  "vulnerability_tags": [
    "telnet_enabled",
    "http_management",
    "snmpv2_default_community",
    "weak_password",
    "no_logging"
  ],
  "contains_secrets": false,
  "anonymized": true,
  "generation_date": "2026-09-22",
  "generator_version": "1.0.0",
  "security_state_details": "Deliberately insecure configuration with common misconfigurations for compliance testing",
  "legacy_device_type": "router",
  "device_class": "router",
  "network_role": "branch",
  "platform": "AlliedWare Plus",
  "model": null,
  "capabilities": [],
  "routing_protocols": [],
  "l2_capable": false,
  "detected_vendor": "allied_telesis",
  "detected_vendor_display": "Allied Telesis AlliedWare Plus",
  "device_class_basis": "filename convention (RT-ALLIED_TELESIS_-M-015.conf)",
  "relabel_version": "2.0.0",
  "relabel_date": "2026-09-22",
  "label_confidence": "verified",
  "routing_capability": false
}