{
  "sample_id": "SW-MIKROTIK_ROUTER-S-017",
  "vendor": "MikroTik",
  "product": "Cloud Router Switch (CRS)",
  "device_type": "switch",
  "os": "RouterOS",
  "version": "v7.x",
  "category": "switch",
  "source_type": "synthetic",
  "source_url": null,
  "license": null,
  "configuration_format": "mikrotik_rsc",
  "security_state": "secure",
  "controls_present": [
    "ssh_v2",
    "https_management",
    "syslog",
    "ntp",
    "strong_auth",
    "password_encryption",
    "session_timeout",
    "default_deny_policy"
  ],
  "controls_absent": [],
  "vulnerability_tags": [],
  "contains_secrets": false,
  "anonymized": true,
  "generation_date": "2026-09-22",
  "generator_version": "1.0.0",
  "security_state_details": "Fully hardened configuration following vendor best practices and CIS benchmark recommendations",
  "legacy_device_type": "switch",
  "device_class": "network_switch",
  "network_role": "unknown",
  "platform": "MikroTik RouterOS",
  "model": null,
  "capabilities": [
    "STP"
  ],
  "routing_protocols": [],
  "l2_capable": true,
  "detected_vendor": "mikrotik_routeros",
  "detected_vendor_display": "MikroTik RouterOS",
  "device_class_basis": "filename convention (SW-MIKROTIK_ROUTER-S-017.rsc)",
  "relabel_version": "2.0.0",
  "relabel_date": "2026-09-22",
  "label_confidence": "verified",
  "routing_capability": false
}