{
  "sample_id": "FW-OPNSENSE-S-003",
  "vendor": "OPNsense",
  "product": "OPNsense",
  "device_type": "firewall",
  "os": "OPNsense",
  "version": "24.x",
  "category": "firewall",
  "source_type": "synthetic",
  "source_url": null,
  "license": null,
  "configuration_format": "opnsense_xml",
  "security_state": "secure",
  "controls_present": [
    "ssh_v2",
    "https_management",
    "syslog",
    "ntp",
    "strong_auth",
    "password_encryption",
    "session_timeout",
    "default_deny_policy"
  ],
  "controls_absent": [],
  "vulnerability_tags": [],
  "contains_secrets": false,
  "anonymized": true,
  "generation_date": "2026-09-22",
  "generator_version": "1.0.0",
  "security_state_details": "Fully hardened configuration following vendor best practices and CIS benchmark recommendations",
  "legacy_device_type": "firewall",
  "device_class": "firewall",
  "network_role": "perimeter",
  "platform": "OPNsense",
  "model": "Open-source / Sophos FW",
  "capabilities": [],
  "routing_protocols": [],
  "l2_capable": false,
  "detected_vendor": "opnsense",
  "detected_vendor_display": "OPNsense",
  "device_class_basis": "model registry (Open-source / Sophos FW)",
  "relabel_version": "2.0.0",
  "relabel_date": "2026-09-22",
  "label_confidence": "verified",
  "routing_capability": false
}