{
  "sample_id": "WF-CISCO_MERAKI-S-005",
  "vendor": "Cisco Meraki",
  "product": "Meraki MR56 / MR46",
  "device_type": "wifi_access_point",
  "os": "Meraki Cloud OS",
  "version": "29.x",
  "category": "wifi",
  "source_type": "synthetic",
  "source_url": null,
  "license": null,
  "configuration_format": "json",
  "security_state": "secure",
  "controls_present": [
    "ssh_v2",
    "https_management",
    "syslog",
    "ntp",
    "strong_auth",
    "password_encryption",
    "session_timeout",
    "default_deny_policy"
  ],
  "controls_absent": [],
  "vulnerability_tags": [],
  "contains_secrets": false,
  "anonymized": true,
  "generation_date": "2026-09-22",
  "generator_version": "1.0.0",
  "security_state_details": "Fully hardened configuration following vendor best practices and CIS benchmark recommendations",
  "legacy_device_type": "wifi_access_point",
  "device_class": "wireless_ap",
  "network_role": "wireless_access",
  "platform": "Cisco Meraki Dashboard",
  "model": null,
  "capabilities": [],
  "routing_protocols": [],
  "l2_capable": false,
  "detected_vendor": "cisco_meraki",
  "detected_vendor_display": "Cisco Meraki",
  "device_class_basis": "defining construct: radio-layer configuration",
  "relabel_version": "2.0.0",
  "relabel_date": "2026-09-22",
  "label_confidence": "verified",
  "routing_capability": false
}