{
  "sample_id": "SW-CISCO_NXOS_SW-S-008",
  "vendor": "Cisco",
  "product": "Nexus 9300 Switch",
  "device_type": "switch",
  "os": "Cisco NX-OS",
  "version": "10.2",
  "category": "switch",
  "source_type": "synthetic",
  "source_url": null,
  "license": null,
  "configuration_format": "cisco_nxos_cli",
  "security_state": "secure",
  "controls_present": [
    "ssh_v2",
    "https_management",
    "syslog",
    "ntp",
    "strong_auth",
    "password_encryption",
    "session_timeout",
    "default_deny_policy"
  ],
  "controls_absent": [],
  "vulnerability_tags": [],
  "contains_secrets": false,
  "anonymized": true,
  "generation_date": "2026-09-22",
  "generator_version": "1.0.0",
  "security_state_details": "Fully hardened configuration following vendor best practices and CIS benchmark recommendations",
  "legacy_device_type": "switch",
  "device_class": "network_switch",
  "network_role": "perimeter",
  "platform": "Cisco NX-OS",
  "model": null,
  "capabilities": [
    "L2_SWITCHING",
    "LINK_AGGREGATION",
    "STP",
    "VLAN"
  ],
  "routing_protocols": [],
  "l2_capable": true,
  "detected_vendor": "cisco_nxos",
  "detected_vendor_display": "Cisco NX-OS",
  "device_class_basis": "defining construct: layer-2 forwarding constructs present",
  "relabel_version": "2.0.0",
  "relabel_date": "2026-09-22",
  "label_confidence": "verified",
  "routing_capability": false
}